{
  "version": "1.0",
  "status": "reference_data_not_field_observations",
  "checked_on": "2026-09-16",
  "studies": [
    {
      "id": "C01",
      "citation_label": "Roubik",
      "year": 2002,
      "title": "The value of bees to the coffee harvest",
      "crop": "coffee",
      "record_type": "field experiment",
      "source_url": "https://stri-sites.si.edu/docs/publications/pdfs/Roubik_coffeepollination.pdf",
      "doi": "10.1038/417708a",
      "access_scope": "article sections",
      "checked_on": "2026-09-16",
      "source_locator": "Indexed article sections: methods/results/discussion; supplements not fully extracted",
      "reported_design": "Panama; 50 two-year-old arabica plants; open and fine-mesh-bagged control branches.",
      "reported_results": "Open branches produced 49% more ripe berries per flower and mean berries were 7% heavier.",
      "reported_analysis": "Paired t-test reported for berry abundance.",
      "project_interpretation": "Use matched branch cohorts and mature harvest outcomes; this does not isolate our stingless colony.",
      "exact_equipment_part_numbers": null,
      "full_replication_extraction_complete": false
    },
    {
      "id": "C02",
      "citation_label": "Klein, Steffan-Dewenter & Tscharntke",
      "year": 2003,
      "title": "Bee pollination and fruit set of Coffea arabica and C. canephora (Rubiaceae)",
      "crop": "coffee",
      "record_type": "field experiment",
      "source_url": "https://bsapubs.onlinelibrary.wiley.com/doi/10.3732/ajb.90.1.153",
      "doi": "10.3732/ajb.90.1.153",
      "access_scope": "article sections",
      "checked_on": "2026-09-16",
      "source_locator": "Indexed article sections: methods/results/discussion; supplements not fully extracted",
      "reported_design": "24 Indonesian agroforestry fields; insect/wind/self and hand-cross comparisons across both crop species.",
      "reported_results": "Canephora fruit set: open 78.1%, hand cross 83.8%, wind plus self 62.3%; open and hand cross were not significantly different.",
      "reported_analysis": null,
      "project_interpretation": "Store treatment mechanism and species; 78.1 minus 62.3 is 15.8 percentage points, not 15.8% relative gain.",
      "exact_equipment_part_numbers": null,
      "full_replication_extraction_complete": false
    },
    {
      "id": "C03",
      "citation_label": "Klein, Steffan-Dewenter & Tscharntke",
      "year": 2003,
      "title": "Fruit set of highland coffee increases with the diversity of pollinating bees",
      "crop": "coffee",
      "record_type": "field survey and experiment",
      "source_url": "https://pubmed.ncbi.nlm.nih.gov/12803911/",
      "doi": "10.1098/rspb.2002.2306",
      "access_scope": "abstract",
      "checked_on": "2026-09-16",
      "source_locator": "Abstract",
      "reported_design": "24 Indonesian arabica agroforestry systems plus single-visit experiments.",
      "reported_results": "Fruit set ranged roughly 60–90% across a bee-richness gradient of 3–20 species; some rare solitary visitors outperformed abundant social species per visit.",
      "reported_analysis": null,
      "project_interpretation": "Do not replace functional performance with total bee counts; landscape richness relationships are not randomized richness treatments.",
      "exact_equipment_part_numbers": null,
      "full_replication_extraction_complete": false
    },
    {
      "id": "C04",
      "citation_label": "Klein, Steffan-Dewenter & Tscharntke",
      "year": 2003,
      "title": "Pollination of Coffea canephora in relation to local and regional agroforestry management",
      "crop": "coffee",
      "record_type": "field survey and experiment",
      "source_url": "https://besjournals.onlinelibrary.wiley.com/doi/abs/10.1046/j.1365-2664.2003.00847.x",
      "doi": "10.1046/j.1365-2664.2003.00847.x",
      "access_scope": "abstract",
      "checked_on": "2026-09-16",
      "source_locator": "Abstract",
      "reported_design": "15 Sulawesi agroforestry systems; bee surveys, bagged/open treatments and pollination efficiency of 15 bee species.",
      "reported_results": "Open fruit set increased with bee diversity/abundance; solitary assemblages provided higher per-visit fruit set than social assemblages.",
      "reported_analysis": null,
      "project_interpretation": "Record habitat, visitor identity and visitation effort; check overlap with other Klein datasets before synthesis.",
      "exact_equipment_part_numbers": null,
      "full_replication_extraction_complete": false
    },
    {
      "id": "C05",
      "citation_label": "Ricketts et al.",
      "year": 2004,
      "title": "Economic value of tropical forest to coffee production",
      "crop": "coffee",
      "record_type": "field experiment and valuation",
      "source_url": "https://doi.org/10.1073/pnas.0405147101",
      "doi": "10.1073/pnas.0405147101",
      "access_scope": "abstract",
      "checked_on": "2026-09-16",
      "source_locator": "Abstract",
      "reported_design": "Costa Rica; pollination experiments along replicated forest-distance gradients.",
      "reported_results": "Estimated forest-linked yield benefit 20% within about 1 km; peaberry frequency reduced 27%; historical valuation about USD60,000/year for one farm.",
      "reported_analysis": null,
      "project_interpretation": "Retain distance, seed form and valuation assumptions; these historical dollar estimates are not our projected revenue.",
      "exact_equipment_part_numbers": null,
      "full_replication_extraction_complete": false
    },
    {
      "id": "C06",
      "citation_label": "Vergara & Badano",
      "year": 2009,
      "title": "Pollinator diversity increases fruit production in Mexican coffee plantations: The importance of rustic management systems",
      "crop": "coffee",
      "record_type": "field survey and experiment",
      "source_url": "https://www.sciencedirect.com/science/article/abs/pii/S016788090800234X",
      "doi": "10.1016/j.agee.2008.08.001",
      "access_scope": "abstract",
      "checked_on": "2026-09-16",
      "source_locator": "Abstract",
      "reported_design": "Central Veracruz management gradient; observational and experimental measurements of diversity and production.",
      "reported_results": "Lower-impact systems had greater visitor richness/diversity and higher fruit production; positive diversity-production associations were reported.",
      "reported_analysis": null,
      "project_interpretation": "Management and landscape covariates need separate fields; do not assume their observational association identifies one causal mechanism.",
      "exact_equipment_part_numbers": null,
      "full_replication_extraction_complete": false
    },
    {
      "id": "C07",
      "citation_label": "Krishnan et al.",
      "year": 2012,
      "title": "Status of pollinators and their efficiency in coffee fruit set in a fragmented landscape mosaic in South India",
      "crop": "coffee",
      "record_type": "field experiment",
      "source_url": "https://www.sciencedirect.com/science/article/abs/pii/S1439179112000291",
      "doi": "10.1016/j.baae.2012.03.007",
      "access_scope": "article sections",
      "checked_on": "2026-09-16",
      "source_locator": "Indexed article sections: methods/results/discussion; supplements not fully extracted",
      "reported_design": "Kodagu robusta; self, no-pollination, wind, open and hand-cross treatments; visitor observations.",
      "reported_results": "Final fruit set: cross 44%, open 33%, wind 22.1%; five-week initial set was unreliable for final set.",
      "reported_analysis": null,
      "project_interpretation": "Keep initial and final outcomes separate and include positive hand-cross comparisons when measuring deficits.",
      "exact_equipment_part_numbers": null,
      "full_replication_extraction_complete": false
    },
    {
      "id": "C08",
      "citation_label": "Boreux et al.",
      "year": 2013,
      "title": "Interactive effects among ecosystem services and management practices on crop production: Pollination in coffee agroforestry systems",
      "crop": "coffee",
      "record_type": "field management analysis",
      "source_url": "https://pmc.ncbi.nlm.nih.gov/articles/PMC3666681/",
      "doi": "10.1073/pnas.1210590110",
      "access_scope": "article sections",
      "checked_on": "2026-09-16",
      "source_locator": "Indexed article sections: methods/results/discussion; supplements not fully extracted",
      "reported_design": "Indian coffee systems; bee abundance, irrigation-induced flowering, shade, lime and environmental variables considered together.",
      "reported_results": "Bee abundance benefited production after accounting for management; irrigation and liming effects could exceed shade-cover effects.",
      "reported_analysis": null,
      "project_interpretation": "Log irrigation and flowering synchrony; cameras at a busy flowering patch cannot alone identify a hive effect.",
      "exact_equipment_part_numbers": null,
      "full_replication_extraction_complete": false
    },
    {
      "id": "C09",
      "citation_label": "Classen et al.",
      "year": 2014,
      "title": "Complementary ecosystem services provided by pest predators and pollinators increase quantity and quality of coffee yields",
      "crop": "coffee",
      "record_type": "factorial field experiment",
      "source_url": "https://pmc.ncbi.nlm.nih.gov/articles/PMC3924087/",
      "doi": "10.1098/rspb.2013.3148",
      "access_scope": "article sections",
      "checked_on": "2026-09-16",
      "source_locator": "Indexed article sections: methods/results/discussion; supplements not fully extracted",
      "reported_design": "180 coffee bushes, Kilimanjaro land-use gradient; vertebrate × pollinator exclusions. Gauze apertures 0.39 × 0.77 mm; strings kept fabric away from flowers.",